{
  "schedule": "Автобусный парк",
  "start": "2026-01-10T00:00:00",
  "end": "2026-01-11T00:00:00",
  "events": [
    {"time": "2026-01-10T00:00:00", "action": "depart", "point": "DEPOT", "point_attrs": {}, "action_attrs": {}},
    {"time": "2026-01-10T06:00:00", "action": "depart", "point": "DEPOT", "point_attrs": {}, "action_attrs": {}},
    {"time": "2026-01-10T06:40:00", "action": "arrive", "point": "AIRPORT", "point_attrs": {}, "action_attrs": {}},
    {"time": "2026-01-10T07:20:00", "action": "arrive", "point": "DEPOT", "point_attrs": {}, "action_attrs": {}},
    {"time": "2026-01-10T08:00:00", "action": "depart", "point": "DEPOT", "point_attrs": {}, "action_attrs": {}},
    {"time": "2026-01-10T08:40:00", "action": "arrive", "point": "AIRPORT", "point_attrs": {}, "action_attrs": {}},
    {"time": "2026-01-10T08:50:00", "action": "depart", "point": "AIRPORT", "point_attrs": {}, "action_attrs": {}},
    {"time": "2026-01-10T09:00:00", "action": "depart", "point": "DEPOT", "point_attrs": {}, "action_attrs": {}},
    {"time": "2026-01-10T09:20:00", "action": "arrive", "point": "DEPOT", "point_attrs": {}, "action_attrs": {}},
    {"time": "2026-01-10T09:40:00", "action": "arrive", "point": "AIRPORT", "point_attrs": {}, "action_attrs": {}},
    {"time": "2026-01-10T10:20:00", "action": "arrive", "point": "DEPOT", "point_attrs": {}, "action_attrs": {}},
    {"time": "2026-01-10T12:00:00", "action": "depart", "point": "DEPOT", "point_attrs": {}, "action_attrs": {}},
    {"time": "2026-01-10T12:40:00", "action": "arrive", "point": "AIRPORT", "point_attrs": {}, "action_attrs": {}},
    {"time": "2026-01-10T13:20:00", "action": "arrive", "point": "DEPOT", "point_attrs": {}, "action_attrs": {}},
    {"time": "2026-01-10T15:00:00", "action": "depart", "point": "DEPOT", "point_attrs": {}, "action_attrs": {}},
    {"time": "2026-01-10T15:40:00", "action": "arrive", "point": "AIRPORT", "point_attrs": {}, "action_attrs": {}},
    {"time": "2026-01-10T16:20:00", "action": "arrive", "point": "DEPOT", "point_attrs": {}, "action_attrs": {}},
    {"time": "2026-01-10T18:00:00", "action": "depart", "point": "DEPOT", "point_attrs": {}, "action_attrs": {}},
    {"time": "2026-01-10T18:40:00", "action": "arrive", "point": "AIRPORT", "point_attrs": {}, "action_attrs": {}},
    {"time": "2026-01-10T19:20:00", "action": "arrive", "point": "DEPOT", "point_attrs": {}, "action_attrs": {}},
    {"time": "2026-01-10T20:00:00", "action": "depart", "point": "DEPOT", "point_attrs": {}, "action_attrs": {}},
    {"time": "2026-01-10T20:40:00", "action": "arrive", "point": "AIRPORT", "point_attrs": {}, "action_attrs": {}},
    {"time": "2026-01-10T21:20:00", "action": "arrive", "point": "DEPOT", "point_attrs": {}, "action_attrs": {}}
  ]
}
