{"schedule":"Юлианский календарь","start":"2026-01-01T00:00:00","end":"2026-05-11T00:00:00","events":[{"time":"2026-01-07T00:00:00","action":"christmas","point":"P","point_attrs":{},"action_attrs":{}},{"time":"2026-04-12T00:00:00","action":"spring_day","point":"P","point_attrs":{},"action_attrs":{}}]}
