{"schedule":"Зависимости","start":"2026-01-01T00:00:00","end":"2026-01-02T00:00:00","events":[{"time":"2026-01-01T00:00:00","action":"x","point":"A","point_attrs":{},"action_attrs":{}},{"time":"2026-01-01T00:00:00","action":"x","point":"A","point_attrs":{},"action_attrs":{}},{"time":"2026-01-01T02:00:00","action":"x","point":"A","point_attrs":{},"action_attrs":{}},{"time":"2026-01-01T02:00:00","action":"x","point":"A","point_attrs":{},"action_attrs":{}},{"time":"2026-01-01T02:30:00","action":"x","point":"A","point_attrs":{},"action_attrs":{}},{"time":"2026-01-01T03:30:00","action":"x","point":"A","point_attrs":{},"action_attrs":{}},{"time":"2026-01-01T04:00:00","action":"x","point":"A","point_attrs":{},"action_attrs":{}},{"time":"2026-01-01T05:00:00","action":"x","point":"A","point_attrs":{},"action_attrs":{}},{"time":"2026-01-01T05:00:00","action":"x","point":"A","point_attrs":{},"action_attrs":{}},{"time":"2026-01-01T08:00:00","action":"x","point":"A","point_attrs":{},"action_attrs":{}}]}
