{
  "schedule": "Атрибуты",
  "start": "2026-09-07T00:00:00",
  "end": "2026-09-08T00:00:00",
  "events": [
    {"time": "2026-09-07T09:00:00", "action": "ring", "point": "BELL", "point_attrs": {"building": "Л", "floors": 5}, "action_attrs": {"subject": "БЖД", "type": "лек", "room": "233/А", "event": "start"}},
    {"time": "2026-09-07T09:45:00", "action": "ring", "point": "BELL", "point_attrs": {"building": "Л", "floors": 5}, "action_attrs": {"subject": "БЖД", "event": "break"}},
    {"time": "2026-09-07T09:50:00", "action": "ring", "point": "BELL", "point_attrs": {"building": "Л", "floors": 5}, "action_attrs": {"subject": "БЖД", "event": "continue"}},
    {"time": "2026-09-07T09:55:00", "action": "tick", "point": "PLAIN", "point_attrs": {}, "action_attrs": {"subject": "БЖД"}},
    {"time": "2026-09-07T10:35:00", "action": "ring", "point": "BELL", "point_attrs": {"building": "Л", "floors": 5}, "action_attrs": {"subject": "БЖД", "event": "end"}},
    {"time": "2026-09-07T13:00:00", "action": "ring", "point": "BELL", "point_attrs": {"building": "Л", "floors": 5}, "action_attrs": {"subject": "БЖД", "type": "прак", "room": "410/Д", "event": "start"}},
    {"time": "2026-09-07T13:45:00", "action": "ring", "point": "BELL", "point_attrs": {"building": "Л", "floors": 5}, "action_attrs": {"subject": "БЖД", "event": "break"}},
    {"time": "2026-09-07T13:50:00", "action": "ring", "point": "BELL", "point_attrs": {"building": "Л", "floors": 5}, "action_attrs": {"subject": "БЖД", "event": "continue"}},
    {"time": "2026-09-07T14:35:00", "action": "ring", "point": "BELL", "point_attrs": {"building": "Л", "floors": 5}, "action_attrs": {"subject": "БЖД", "event": "end"}}
  ]
}
