{
  "schedule": "Fill gaps pack",
  "start": "2026-01-01T00:00:00",
  "end": "2026-01-02T00:00:00",
  "events": [
    {"time": "2026-01-01T00:00:00", "action": "ring", "point": "BELL", "point_attrs": {}, "action_attrs": {}},
    {"time": "2026-01-01T01:00:00", "action": "ring", "point": "BELL", "point_attrs": {}, "action_attrs": {}},
    {"time": "2026-01-01T01:30:00", "action": "ring", "point": "BELL", "point_attrs": {}, "action_attrs": {}},
    {"time": "2026-01-01T03:00:00", "action": "ring", "point": "BELL", "point_attrs": {}, "action_attrs": {}},
    {"time": "2026-01-01T04:10:00", "action": "ring", "point": "BELL", "point_attrs": {}, "action_attrs": {}},
    {"time": "2026-01-01T04:30:00", "action": "ring", "point": "BELL", "point_attrs": {}, "action_attrs": {}},
    {"time": "2026-01-01T06:00:00", "action": "ring", "point": "BELL", "point_attrs": {}, "action_attrs": {}},
    {"time": "2026-01-01T07:05:00", "action": "ring", "point": "BELL", "point_attrs": {}, "action_attrs": {}},
    {"time": "2026-01-01T07:30:00", "action": "ring", "point": "BELL", "point_attrs": {}, "action_attrs": {}}
  ]
}
