{"schedule":"TZ Offsets","start":"2026-01-09T00:00:00","end":"2026-01-10T00:00:00","events":[{"time":"2026-01-09T06:00:00","action":"x","point":"A","point_attrs":{},"action_attrs":{}},{"time":"2026-01-09T07:00:00","action":"y","point":"A","point_attrs":{},"action_attrs":{}},{"time":"2026-01-09T18:00:00","action":"x","point":"A","point_attrs":{},"action_attrs":{}},{"time":"2026-01-09T19:00:00","action":"y","point":"A","point_attrs":{},"action_attrs":{}}]}
