{
  "schedule": "Имена в словарях",
  "start": "2026-01-01T00:00:00",
  "end": "2026-01-02T00:00:00",
  "events": [
    {"time": "2026-01-01T00:00:00", "action": "ring", "point": "BELL", "point_attrs": {}, "action_attrs": {"subject": "БЖД", "room": "233/А", "label": "БЖД (233/А)"}},
    {"time": "2026-01-01T00:01:00", "action": "ring", "point": "BELL", "point_attrs": {}, "action_attrs": {"subject": "БЖД"}},
    {"time": "2026-01-01T02:00:00", "action": "ring", "point": "BELL", "point_attrs": {}, "action_attrs": {"subject": "БЖД", "room": "233/А"}}
  ]
}
