{"schedule":"Reverse","start":"2026-01-01T00:00:00","end":"2026-01-02T00:00:00","events":[{"time":"2026-01-01T06:00:00","action":"stop","point":"A","point_attrs":{},"action_attrs":{}},{"time":"2026-01-01T06:20:00","action":"stop","point":"B","point_attrs":{},"action_attrs":{}},{"time":"2026-01-01T06:50:00","action":"stop","point":"B","point_attrs":{},"action_attrs":{}},{"time":"2026-01-01T08:10:00","action":"stop","point":"B","point_attrs":{},"action_attrs":{}},{"time":"2026-01-01T08:40:00","action":"stop","point":"B","point_attrs":{},"action_attrs":{}},{"time":"2026-01-01T09:00:00","action":"stop","point":"A","point_attrs":{},"action_attrs":{}}]}
